{
  "$schema": "https://raw.githubusercontent.com/10kseason/TenRiff/main/docs/tenriff-skin.schema.json",
  "format": "tenriff-skin",
  "version": 1,
  "name": "LUNAR FRACTURE // Void Garden 7K",
  "author": "Luna × 윾이",
  "lobby": {
    "background": "lobby/background.jpg",
    "logo": "lobby/logo.png",
    "background_opacity": 0.78
  },
  "gameplay": {
    "background": "gameplay/background.jpg",
    "background_opacity": 0.62,
    "gear": "gameplay/gear.png",
    "note_width_ratio": 0.94,
    "note_height_ratio": 0.86,
    "judgement_line_position": 0.84,
    "full_lane_receptors": true,
    "modes": {
      "7k": {
        "lane_map": ["white-l", "violet-l", "cyan-l", "center", "cyan-r", "violet-r", "white-r"],
        "note": "gameplay/note-{lane}.png",
        "hold_head": "gameplay/hold-head-{lane}.png",
        "hold_body": "gameplay/hold-body-{lane}.png",
        "hold_tail": "gameplay/hold-tail-{lane}.png",
        "key_idle": "gameplay/key-idle-{lane}.png",
        "key_pressed": "gameplay/key-pressed-{lane}.png",
        "column_widths": [1.0, 1.0, 1.0, 1.12, 1.0, 1.0, 1.0],
        "column_spacings": [0.035, 0.035, 0.05, 0.05, 0.035, 0.035]
      }
    }
  }
}
